time21_5,latitude,longitude,halfAngle,speed,type,isMostAccurate,associatedCMEID,note,catalog,featureCode,dataLevel,measurementTechnique,imageType,tilt,minorHalfWidth,speedMeasuredAtHeight,submissionTime,versionId,link
2022-03-26T09:54Z,14.0,-95.0,22.0,315.0,S,True,2022-03-25T22:24:00-CME-001,,M2M_CATALOG,LE,0,SWPC_CAT,running difference,,,,2022-03-26T15:18Z,1,https://webtools.ccmc.gsfc.nasa.gov/DONKI/view/CMEAnalysis/19536/-1
2022-03-27T08:38Z,13.0,156.0,35.0,343.0,S,True,2022-03-26T22:12:00-CME-001,"Because of the faintness of the front of the CME, this analysis is very approximate.",M2M_CATALOG,LE,1,SWPC_CAT,direct,,,,2022-10-10T19:11Z,2,https://webtools.ccmc.gsfc.nasa.gov/DONKI/view/CMEAnalysis/19544/-1
2022-03-28T07:33Z,-32.0,-53.0,23.0,441.0,S,True,2022-03-28T00:36:00-CME-001,These parameters were obtained using SOHO LASCO and STEREO A COR2 imagery in SWPC_CAT.,M2M_CATALOG,LE,0,SWPC_CAT,running difference,,,14.0,2022-03-28T16:39Z,1,https://webtools.ccmc.gsfc.nasa.gov/DONKI/view/CMEAnalysis/19568/-1
2022-03-28T17:19Z,7.0,12.0,45.0,662.0,C,True,2022-03-28T12:09:00-CME-001,Final analysis with later imagery.,M2M_CATALOG,LE,1,SWPC_CAT,direct,,,,2022-10-10T19:12Z,3,https://webtools.ccmc.gsfc.nasa.gov/DONKI/view/CMEAnalysis/19565/-1
2022-03-29T00:58Z,3.0,3.0,50.0,760.0,C,True,2022-03-28T20:23:00-CME-001,This SWPC_CAT measurement tracks the shock front of the CME visible in SOHO LASCO C2/C3 and STEREO A COR2 difference imagery. The longitude/width was approximated by considering the orientation of the CME as it emerges from the occulting disk in STEREO A COR2.,M2M_CATALOG,SH,1,SWPC_CAT,running difference,,,17.0,2022-03-29T13:37Z,1,https://webtools.ccmc.gsfc.nasa.gov/DONKI/view/CMEAnalysis/19575/-1
2022-03-30T09:52Z,19.0,-175.0,52.0,1048.0,O,True,2022-03-30T06:24:00-CME-001,"We have mostly good imagery of the event, except a bit of missing COR2A data near the start.",M2M_CATALOG,SH,0,SWPC_CAT,running difference,,,20.5,2022-03-30T13:16Z,1,https://webtools.ccmc.gsfc.nasa.gov/DONKI/view/CMEAnalysis/19587/-1
2022-03-30T21:49Z,0.0,15.0,40.0,808.0,C,True,2022-03-30T18:23:00-CME-001,Remeasured following downlink of SOHO LASCO C3 coronagraph data and more STEREO A COR2 data.  This might also better match the apparent directionality of the eruption away from the source region.,M2M_CATALOG,SH,0,SWPC_CAT,running difference,,,16.2,2022-03-30T21:29Z,1,https://webtools.ccmc.gsfc.nasa.gov/DONKI/view/CMEAnalysis/19599/-1
2022-03-31T11:40Z,-17.0,-158.0,33.0,395.0,S,True,2022-03-31T03:23:00-CME-001,,M2M_CATALOG,LE,1,SWPC_CAT,direct,,,,2022-03-31T18:35Z,2,https://webtools.ccmc.gsfc.nasa.gov/DONKI/view/CMEAnalysis/19615/-1
2022-04-01T05:38Z,34.0,-98.0,32.0,451.0,S,True,2022-03-31T18:58:00-CME-001,Source longitude was not able to be determined precisely due to the event likely being beyond the limb.,M2M_CATALOG,LE,0,SWPC_CAT,running difference,,,5.0,2022-04-01T15:29Z,1,https://webtools.ccmc.gsfc.nasa.gov/DONKI/view/CMEAnalysis/19627/-1
2022-04-01T00:54Z,-3.0,48.0,35.0,576.0,C,True,2022-03-31T19:09:00-CME-001,There is a data gap in SOHO LASCO C2/C3 from 2022-03-31T19:06Z to 23:42Z so the parameters were determined using the source location and by comparing the limited imagery from SOHO LASCO C3 with STEREO A COR2. Speed measurements ranged from ~600-700 km/s.,M2M_CATALOG,SH,0,SWPC_CAT,running difference,,,23.0,2022-04-01T13:48Z,2,https://webtools.ccmc.gsfc.nasa.gov/DONKI/view/CMEAnalysis/19622/-1
2022-04-02T16:12Z,-15.0,54.0,45.0,1370.0,O,True,2022-04-02T13:38:00-CME-001,Bulk CME measurement based off of matching features seen in SOHO LASCO C3 and STEREO A COR2. There are parts of this CME that are more northern that were not included in this measurement. A best fit based off of the shock and leading edge features was used for these parameters.,M2M_CATALOG,LE,0,SWPC_CAT,running difference,,,,2022-04-02T16:53Z,1,https://webtools.ccmc.gsfc.nasa.gov/DONKI/view/CMEAnalysis/19642/-1
2022-04-03T21:19Z,-4.0,22.0,35.0,702.0,C,True,2022-04-03T16:38:00-CME-001,Updated parameters based off of new imagery. The feature tracked is the more solid front of the CME as seen in STEREO A COR2. The longitude is based off of the source location of the CME.,M2M_CATALOG,TE,0,StereoCAT,running difference,,,,2022-04-04T21:07Z,1,https://webtools.ccmc.gsfc.nasa.gov/DONKI/view/CMEAnalysis/19663/-1
2022-04-03T20:59Z,31.0,58.0,15.0,767.0,C,True,2022-04-03T17:00:00-CME-001,This measurement was partly obscured by the CME to the southwest that occurred very nearly after.,M2M_CATALOG,LE,0,StereoCAT,direct,,,,2022-04-04T21:30Z,4,https://webtools.ccmc.gsfc.nasa.gov/DONKI/view/CMEAnalysis/19664/-1
2022-04-04T17:52Z,21.0,110.0,35.0,337.0,S,True,2022-04-04T04:00:00-CME-001,This SWPC_CAT measurement approximates the longitude of the CME by finding the best possible fit between the features observed in SOHO LASCO C3 and STEREO A COR2 difference imagery.,M2M_CATALOG,LE,1,SWPC_CAT,running difference,,,11.8,2022-04-05T20:01Z,3,https://webtools.ccmc.gsfc.nasa.gov/DONKI/view/CMEAnalysis/19679/-1
2022-04-04T15:30Z,-24.0,110.0,33.0,777.0,C,True,2022-04-04T11:00:00-CME-001,"Speeds consistently measured in the 767-800 km/s range. The use of SOHO LASCO C2 imagery produced higher speeds, possibly due to the CME slowing down in later imagery, hence why SOHO LASCO C3 and STEREO A COR2 imagery was used in the final measurement.",M2M_CATALOG,SH,0,SWPC_CAT,running difference,,,18.0,2022-04-04T17:31Z,1,https://webtools.ccmc.gsfc.nasa.gov/DONKI/view/CMEAnalysis/19657/-1
2022-04-04T18:53Z,20.0,-44.0,41.0,526.0,C,True,2022-04-04T11:36:00-CME-001,This SWPC_CAT measurement approximates the longitude of the CME by matching the orientation of the CME's leading edge in SOHO LASCO C3 difference imagery with the partial halo feature seen in STEREO A COR2 difference imagery.,M2M_CATALOG,LE,1,SWPC_CAT,running difference,,,15.5,2022-04-05T15:07Z,2,https://webtools.ccmc.gsfc.nasa.gov/DONKI/view/CMEAnalysis/19669/-1
2022-04-05T04:08Z,-20.0,-20.0,26.0,449.0,S,True,2022-04-04T22:12:00-CME-001,This SWPC_CAT measurement approximates the longitude of the CME based on the eruption signature visible in SDO and the width based on an appropriate fit between STEREO A COR2 and SOHO LASCO C3.,M2M_CATALOG,LE,1,SWPC_CAT,running difference,,,16.5,2022-04-05T18:47Z,2,https://webtools.ccmc.gsfc.nasa.gov/DONKI/view/CMEAnalysis/19676/-1
2022-04-05T15:26Z,18.0,112.0,31.0,245.0,S,True,2022-04-04T23:12:00-CME-001,This SWPC_CAT measurement tracks the faint leading edge of the CME as it emerges from the occulting disk in SOHO LASCO C2 and STEREO A COR2 difference imagery. The derived longitude is approximate and may be +/-10 degrees.,M2M_CATALOG,LE,1,SWPC_CAT,running difference,,,6.1,2022-04-05T20:22Z,2,https://webtools.ccmc.gsfc.nasa.gov/DONKI/view/CMEAnalysis/19683/-1
2022-04-05T10:04Z,5.0,121.0,19.0,397.0,S,True,2022-04-05T01:12:00-CME-001,The source eruption was not able to be determined with precision due to the event being off the western limb.,M2M_CATALOG,LE,0,SWPC_CAT,running difference,,,5.0,2022-04-06T18:49Z,1,https://webtools.ccmc.gsfc.nasa.gov/DONKI/view/CMEAnalysis/19690/-1
2022-04-07T02:19Z,27.0,148.0,52.0,520.0,C,True,2022-04-06T20:54:00-CME-001,A SOHO coronagraph data outage was present prior to 2022-04-07T20:54Z and thus earlier frames of this event were not able to be analyzed; the event was in progress at the time of data resumption. This measurement incorporates the northern leading edge of the leading edge in SOHO C3 coronagraph imagery.,M2M_CATALOG,LE,1,SWPC_CAT,direct,,,,2022-10-10T19:13Z,2,https://webtools.ccmc.gsfc.nasa.gov/DONKI/view/CMEAnalysis/19702/-1
2022-04-07T14:08Z,-31.0,-40.0,43.0,457.0,S,True,2022-04-07T05:36:00-CME-001,"SOHO LASCO C3 imagery was partially blocked by the pylon (which lined up almost perfectly with the leading edge) and the CME boundary became very faint in later STEREO A COR2 imagery. However, this was mostly navigated by adjusting the image brightness and contrast.",M2M_CATALOG,LE,1,SWPC_CAT,direct,,,,2022-10-10T19:13Z,2,https://webtools.ccmc.gsfc.nasa.gov/DONKI/view/CMEAnalysis/19700/-1
2022-04-09T20:27Z,-32.0,19.0,35.0,422.0,S,True,2022-04-09T09:12:00-CME-001,Updated measurement using more coronagraph imagery.,M2M_CATALOG,LE,0,SWPC_CAT,running difference,,,15.0,2022-04-09T18:35Z,1,https://webtools.ccmc.gsfc.nasa.gov/DONKI/view/CMEAnalysis/19715/-1
2022-04-09T16:03Z,26.0,-144.0,29.0,772.0,C,True,2022-04-09T12:09:00-CME-001,This measurement uses a wider half width to encompass the bulk of the CME that became apparent with more available imagery.,M2M_CATALOG,LE,0,SWPC_CAT,running difference,,,15.0,2022-04-09T16:23Z,1,https://webtools.ccmc.gsfc.nasa.gov/DONKI/view/CMEAnalysis/19711/-1
2022-04-10T04:27Z,-15.0,90.0,21.0,387.0,S,True,2022-04-09T19:24:00-CME-001,,M2M_CATALOG,LE,0,SWPC_CAT,running difference,,,11.0,2022-04-10T14:11Z,1,https://webtools.ccmc.gsfc.nasa.gov/DONKI/view/CMEAnalysis/19723/-1
2022-04-10T15:10Z,25.0,-136.0,12.0,552.0,C,True,2022-04-10T09:24:00-CME-001,"These parameters were obtained using knowledge of the source location and the best fit in SWPC_CAT. Due to the source location being beyond the east limb in STEREO A EUVI and SDO AIA imagery, the longitude may vary by approximately +/- 10 degrees.",M2M_CATALOG,LE,0,SWPC_CAT,running difference,,,13.0,2022-04-10T18:49Z,1,https://webtools.ccmc.gsfc.nasa.gov/DONKI/view/CMEAnalysis/19727/-1
2022-04-10T18:56Z,22.0,-138.0,22.0,808.0,C,True,2022-04-10T14:53:00-CME-001,Updated measurement using more SOHO LASCO C3 and STEREO A COR2 imagery.,M2M_CATALOG,LE,0,SWPC_CAT,running difference,,,19.0,2022-04-11T19:16Z,1,https://webtools.ccmc.gsfc.nasa.gov/DONKI/view/CMEAnalysis/19743/-1
2022-04-11T15:51Z,-22.0,-103.0,15.0,319.0,S,True,2022-04-11T04:48:00-CME-001,There is some uncertainty in the longitude by about 10 degrees. The best fit in SWPC_CAT between SOHO LASCO C2/C3 and STEREO A COR2 had longitudes around -100 to -110.,M2M_CATALOG,LE,0,SWPC_CAT,running difference,,,9.0,2022-04-11T17:12Z,1,https://webtools.ccmc.gsfc.nasa.gov/DONKI/view/CMEAnalysis/19742/-1
2022-04-11T11:45Z,-6.0,2.0,46.0,553.0,C,True,2022-04-11T06:00:00-CME-001,,M2M_CATALOG,LE,0,SWPC_CAT,running difference,,,17.0,2022-04-11T12:16Z,1,https://webtools.ccmc.gsfc.nasa.gov/DONKI/view/CMEAnalysis/19736/-1
2022-04-12T01:36Z,5.0,-166.0,44.0,732.0,C,True,2022-04-11T20:23:00-CME-001,"This SWPC_CAT measurement approximates the longitude of the CME by considering how the event emerges as a halo in later SOHO LASCO C3 difference imagery and how the CME profile can be appropriately matched to the leading edge of the CME observed in STEREO A COR2 difference imagery. Using SWPC_CAT, the longitude was approximated to be between -165 and -170 degrees. Multiple measurements yielded speeds between 680 km/s to 780 km/s.",M2M_CATALOG,LE,1,SWPC_CAT,running difference,,,13.0,2022-04-12T13:04Z,1,https://webtools.ccmc.gsfc.nasa.gov/DONKI/view/CMEAnalysis/19747/-1
2022-04-13T15:20Z,-29.0,91.0,17.0,383.0,S,True,2022-04-13T05:00:00-CME-001,"The CME contained a bulk/brighter portion which remained behind the shock front, but it was believed that the measuring using the shock front gave a more accurate measurement of this CME between coronagraph imagery and was more representative of the time at 21.5 Rs.",M2M_CATALOG,SH,0,SWPC_CAT,running difference,,,12.0,2022-04-13T20:58Z,1,https://webtools.ccmc.gsfc.nasa.gov/DONKI/view/CMEAnalysis/19765/-1
2022-04-13T17:36Z,10.0,-163.0,56.0,887.0,C,True,2022-04-13T13:23:00-CME-001,"Multiple measurements produced speeds in the 890 to 910 km/s range. There is a data gap in SOHO LASCO C2/C3 from 2022-04-13T12:18Z to 15:21Z so a few earlier frames are missing from the measurement, but STEREO A COR2 imagery was able to fill in the gaps.",M2M_CATALOG,SH,0,SWPC_CAT,running difference,,,16.3,2022-04-13T20:46Z,2,https://webtools.ccmc.gsfc.nasa.gov/DONKI/view/CMEAnalysis/19760/-1
2022-04-14T11:05Z,-14.0,138.0,33.0,334.0,S,True,2022-04-14T02:36:00-CME-001,"The CME was only visibly in STEREO A COR2 for a few frames since it was a faint event, but the CME was bright in SOHO LASCO C3 which made up for the gaps. Multiple measurements produced speeds between 322 km/s and 334 km/s.",M2M_CATALOG,SH,0,SWPC_CAT,running difference,,,13.0,2022-04-14T16:36Z,1,https://webtools.ccmc.gsfc.nasa.gov/DONKI/view/CMEAnalysis/19770/-1
2022-04-14T15:27Z,-11.0,-131.0,38.0,599.0,C,True,2022-04-14T09:24:00-CME-001,"Measurement of the bulk portion of the CME. Another measurement was taken which included a very faint upper portion of the CME, but the speed and longitude were not far off from the bulk portion measurement which seemed more representative of the CME. Only three frames available in SOHO LASCO C3 from 2022-04-14T12:44ZZ to 16:18Z, but there were plenty of STEREO A COR2 frames to fill in the gaps.",M2M_CATALOG,SH,0,SWPC_CAT,running difference,,,24.0,2022-04-14T17:47Z,1,https://webtools.ccmc.gsfc.nasa.gov/DONKI/view/CMEAnalysis/19772/-1
2022-04-15T06:55Z,31.0,20.0,30.0,414.0,S,True,2022-04-14T21:23:00-CME-001,The CME edge became diffuse in later time stamps in STEREO A COR2 imagery so SOHO LASCO C2/C3 imagery was mainly used to make this measurement.,M2M_CATALOG,LE,0,SWPC_CAT,running difference,,,12.0,2022-04-15T15:45Z,1,https://webtools.ccmc.gsfc.nasa.gov/DONKI/view/CMEAnalysis/19782/-1
2022-04-15T07:21Z,-15.0,-117.0,43.0,605.0,C,True,2022-04-15T01:24:00-CME-001,"Data gap/unusable frames in SOHO LASCO C3 from 2022-04-15T02:30Z to 05:06Z, but there were plenty of STEREO A COR2 frames to fill in the gaps. Speed measurements ranged from 599 km/s to 640 km/s.",M2M_CATALOG,LE,0,null,running difference,,,17.0,2022-04-15T15:52Z,2,https://webtools.ccmc.gsfc.nasa.gov/DONKI/view/CMEAnalysis/19784/-1
2022-04-15T10:48Z,-47.0,166.0,20.0,521.0,C,True,2022-04-15T04:38:00-CME-001,The shock front becomes diffuse in later STEREO A COR2 imagery so the leading edge was used in this measurement.,M2M_CATALOG,LE,0,SWPC_CAT,running difference,,,11.0,2022-04-15T16:55Z,1,https://webtools.ccmc.gsfc.nasa.gov/DONKI/view/CMEAnalysis/19788/-1
2022-04-15T16:35Z,-9.0,-104.0,38.0,814.0,C,True,2022-04-15T12:04:00-CME-001,The CME was only visible in SOHO LASCO C3 for three frames due to the limited imagery available for this event. STEREO A COR2 imagery helped guide a majority of this measurement,M2M_CATALOG,LE,0,SWPC_CAT,running difference,,,21.0,2022-04-15T18:59Z,1,https://webtools.ccmc.gsfc.nasa.gov/DONKI/view/CMEAnalysis/19790/-1
2022-04-15T18:03Z,-18.0,-105.0,38.0,660.0,C,True,2022-04-15T13:39:00-CME-001,"There is a data gap in SOHO LASCO C2 from 14:11Z to 16:18Z so only two frames were usable in this measurement. Also, the CME appeared to move faster in earlier STEREO A COR2 frames so those were omitted as they were less representative of the CME speed.",M2M_CATALOG,LE,0,SWPC_CAT,running difference,,,16.0,2022-04-15T19:13Z,1,https://webtools.ccmc.gsfc.nasa.gov/DONKI/view/CMEAnalysis/19792/-1
2022-04-16T05:56Z,-20.0,-100.0,26.0,455.0,S,True,2022-04-15T18:54:00-CME-001,The source has not been found and CME parameters are derived from the best fit in SWPC CAT.,M2M_CATALOG,LE,1,SWPC_CAT,direct,,,,2022-04-18T22:55Z,4,https://webtools.ccmc.gsfc.nasa.gov/DONKI/view/CMEAnalysis/19804/-1
2022-04-16T18:12Z,30.0,127.0,45.0,520.0,C,True,2022-04-16T11:54:00-CME-001,"This analysis took into account a wider and fainter shock which looks more halo-like in STEREO COR2 A, as compared to a much brighter but narrower bulk of the CME.",M2M_CATALOG,LE,1,SWPC_CAT,direct,,,,2022-04-17T01:32Z,4,https://webtools.ccmc.gsfc.nasa.gov/DONKI/view/CMEAnalysis/19801/-1
2022-04-16T23:42Z,27.0,122.0,18.0,600.0,C,True,2022-04-16T18:54:00-CME-001,,M2M_CATALOG,TE,0,SWPC_CAT,running difference,,,,2022-04-17T19:26Z,1,https://webtools.ccmc.gsfc.nasa.gov/DONKI/view/CMEAnalysis/19824/-1
2022-04-17T16:45Z,-25.0,95.0,25.0,261.0,S,True,2022-04-16T21:36:00-CME-001,,M2M_CATALOG,LE,1,SWPC_CAT,running difference,,,,2022-04-17T16:25Z,1,https://webtools.ccmc.gsfc.nasa.gov/DONKI/view/CMEAnalysis/19818/-1
2022-04-17T04:54Z,-40.0,-177.0,26.0,884.0,C,True,2022-04-17T01:24:00-CME-001,Parameters derived from the best fit in SWPC CAT.,M2M_CATALOG,TE,1,SWPC_CAT,direct,,,,2022-04-18T22:51Z,4,https://webtools.ccmc.gsfc.nasa.gov/DONKI/view/CMEAnalysis/19820/-1
2022-04-17T07:29Z,-4.0,-74.0,43.0,900.0,C,True,2022-04-17T03:48:00-CME-001,"Analysis based on SOHO LASCO imagery only and on the source (flare, AR) location b/c of a large data gap in STEREO A COR2 imagery. After the gap, the front is already outside of the field of view of the coronagraph, but the right hand boundary is still clearly seen in COR2A and somewhat confirms our SWPC CAT fit and parameters.",M2M_CATALOG,LE,1,SWPC_CAT,running difference,,,,2022-04-18T22:50Z,2,https://webtools.ccmc.gsfc.nasa.gov/DONKI/view/CMEAnalysis/19812/-1
2022-04-17T07:57Z,-10.0,-102.0,47.0,841.0,C,True,2022-04-17T03:48:00-CME-001,"The front of this CME becomes more diffuse as it travels out of the field of view, it has some difficulties with analyzing it, but I believe the source is closer to the limb around -90 to -100 degrees.",SEPVAL_CME_CATALOG,LE,2,StereoCAT,direct,,,,2023-10-20T18:58Z,3,https://webtools.ccmc.gsfc.nasa.gov/DONKI/view/CMEAnalysis/27357/-1
2022-04-17T21:09Z,-16.0,147.0,48.0,767.0,C,True,2022-04-17T16:36:00-CME-001,"Because the source location is likely on the back side, this analysis is produced by fitting of fronts in two coronagraphs in SWPC CAT. The CME has an uneven shape and the fit is not perfect, so parameters are approximate.",M2M_CATALOG,LE,1,SWPC_CAT,direct,,,,2022-04-18T22:47Z,3,https://webtools.ccmc.gsfc.nasa.gov/DONKI/view/CMEAnalysis/19834/-1
2022-04-18T05:56Z,-26.0,71.0,27.0,341.0,S,True,2022-04-17T19:39:00-CME-001,Analysis is based on the longitude of the flare associated with the CME; this longitude also  provides a good fit in SWPC cat.,M2M_CATALOG,TE,0,SWPC_CAT,running difference,,,,2022-04-18T22:44Z,2,https://webtools.ccmc.gsfc.nasa.gov/DONKI/view/CMEAnalysis/19831/-1
2022-04-18T13:57Z,-28.0,109.0,31.0,388.0,S,True,2022-04-18T05:39:00-CME-001,Analysis was derived from the best fit in SWPC CAT (as the source was not found).,M2M_CATALOG,LE,1,SWPC_CAT,direct,,,,2022-10-10T19:13Z,2,https://webtools.ccmc.gsfc.nasa.gov/DONKI/view/CMEAnalysis/19840/-1
2022-04-18T13:21Z,32.0,-82.0,13.0,635.0,C,True,2022-04-18T08:39:00-CME-001,"The longitude was based on the general region of the source location, but more so the fit between SOHO LASCO C3 and STEREO A COR2 coronagraphs. Longitude may vary +/- 10 degrees since source location is obscured by active region 2993.",M2M_CATALOG,LE,0,SWPC_CAT,running difference,,,10.0,2022-04-20T16:07Z,1,https://webtools.ccmc.gsfc.nasa.gov/DONKI/view/CMEAnalysis/19864/-1
2022-04-19T15:27Z,-3.0,107.0,23.0,282.0,S,True,2022-04-19T00:24:00-CME-001,The shock front moves faster than the bulk of the CME so this measurement includes later time frames to take into account how much the CME speeds up over time. There is also a data gap in SOHO LASCO C2 from 05:12Z to 11:24Z so primarily STEREO A COR2 imagery is used.,M2M_CATALOG,LE,0,SWPC_CAT,running difference,,,15.0,2022-04-19T18:00Z,1,https://webtools.ccmc.gsfc.nasa.gov/DONKI/view/CMEAnalysis/19844/-1
2022-04-19T14:01Z,20.0,107.0,26.0,337.0,S,True,2022-04-19T02:09:00-CME-001,"These parameters were obtained using knowledge of the source location on or beyond the limb the best fit between SOHO LASCO C2 and STEREO A COR2 in SWPC_CAT. Due to the source location on or just beyond the west limb, there is not a direct view of the eruption on the disk. The longitude may vary by around +/- 10 degrees.",M2M_CATALOG,TE,0,SWPC_CAT,running difference,,,13.0,2022-04-19T19:04Z,1,https://webtools.ccmc.gsfc.nasa.gov/DONKI/view/CMEAnalysis/19848/-1
2022-04-19T23:59Z,-13.0,109.0,45.0,428.0,S,True,2022-04-19T16:09:00-CME-001,The longitude may differ +/- 10 degrees from what is listed due to the source location being beyond the limb. Current longitude was mostly estimated based on the best fit between coronagraph imagery. Multiple measurements produced speeds in the 400-440 km/s range.,M2M_CATALOG,LE,0,SWPC_CAT,running difference,,,7.0,2022-04-19T19:03Z,1,https://webtools.ccmc.gsfc.nasa.gov/DONKI/view/CMEAnalysis/19847/-1
2022-04-19T23:58Z,-55.0,-80.0,21.0,828.0,C,True,2022-04-19T19:36:00-CME-001,"CME is partially blocked by the pylon in SOHO LASCO C3 imagery, and the boundary becomes faint in both C3 and STEREO A COR2 imagery. Speed measurements ranged from ~770 km/s to ~830 km/s.",M2M_CATALOG,LE,0,SWPC_CAT,running difference,,,12.0,2022-04-20T17:29Z,1,https://webtools.ccmc.gsfc.nasa.gov/DONKI/view/CMEAnalysis/19871/-1
2022-04-20T06:56Z,-35.0,104.0,27.0,353.0,S,True,2022-04-19T21:24:00-CME-001,"The event partially overlaps with another CME, making the front difficult to see.",M2M_CATALOG,LE,0,SWPC_CAT,running difference,,,11.6,2022-04-20T16:24Z,1,https://webtools.ccmc.gsfc.nasa.gov/DONKI/view/CMEAnalysis/19866/-1
2022-04-20T07:50Z,-27.0,99.0,36.0,616.0,C,True,2022-04-20T02:00:00-CME-001,"Stereo Ahead COR2A imagery was not available for this event, but the source location was estimated from beyond the western limb using SDO imagery.",M2M_CATALOG,LE,0,SWPC_CAT,running difference,,,11.5,2022-04-20T14:25Z,1,https://webtools.ccmc.gsfc.nasa.gov/DONKI/view/CMEAnalysis/19862/-1
2022-04-20T07:49Z,-18.0,101.0,30.0,868.0,C,True,2022-04-20T04:12:00-CME-001,"The source latitude and longitude were able to be discerned by SDO, however, a data gap in Stereo Ahead COR2A limited further analysis of this event, and the measurement was taken with one coronagraph.",M2M_CATALOG,LE,0,SWPC_CAT,running difference,,,19.0,2022-04-20T13:21Z,1,https://webtools.ccmc.gsfc.nasa.gov/DONKI/view/CMEAnalysis/19860/-1
2022-04-20T20:49Z,-31.0,107.0,33.0,448.0,S,True,2022-04-20T13:26:00-CME-001,"The eruption was more easily discernible in direct imagery but its front was more easily able to be tracked in running difference imagery. Thus, the CME was generally faint and difficult to measure around its width.",M2M_CATALOG,LE,0,SWPC_CAT,running difference,,,6.6,2022-04-20T19:51Z,1,https://webtools.ccmc.gsfc.nasa.gov/DONKI/view/CMEAnalysis/19877/-1
2022-04-20T23:24Z,-24.0,116.0,36.0,409.0,S,True,2022-04-20T16:48:00-CME-001,The shock front is easily seen in running difference imagery but not as easily ascertained using direct white light imagery. A portion of the southern feature is faint but was incorporated into this measurement though the shock front is asymmetrical.,M2M_CATALOG,LE,0,SWPC_CAT,running difference,,,9.5,2022-04-20T19:59Z,1,https://webtools.ccmc.gsfc.nasa.gov/DONKI/view/CMEAnalysis/19879/-1
2022-04-21T04:00Z,-17.0,105.0,32.0,457.0,S,True,2022-04-20T20:24:00-CME-001,The front is faint in COR2A but easily discernible in SOHO C2 and C3 imagery.,M2M_CATALOG,LE,0,SWPC_CAT,running difference,,,11.0,2022-04-21T16:27Z,1,https://webtools.ccmc.gsfc.nasa.gov/DONKI/view/CMEAnalysis/19891/-1
2022-04-21T11:16Z,20.0,-24.0,23.0,379.0,S,True,2022-04-21T02:36:00-CME-001,Measurement of the faint shock front feature out ahead of the bulk of the CME cloud.,M2M_CATALOG,SH,0,SWPC_CAT,running difference,,,12.0,2022-04-21T15:44Z,1,https://webtools.ccmc.gsfc.nasa.gov/DONKI/view/CMEAnalysis/19889/-1
2022-04-22T07:14Z,-27.0,133.0,40.0,428.0,S,True,2022-04-21T23:12:00-CME-001,The front was faint in Stereo A COR2A running difference imagery and thus its width was extrapolated somewhat within the measuring tool using available white light coronagraph imagery.,M2M_CATALOG,LE,0,SWPC_CAT,running difference,,,10.2,2022-04-22T12:43Z,1,https://webtools.ccmc.gsfc.nasa.gov/DONKI/view/CMEAnalysis/19895/-1
2022-04-23T03:12Z,-31.0,138.0,29.0,318.0,S,True,2022-04-22T16:36:00-CME-001,,M2M_CATALOG,LE,0,SWPC_CAT,running difference,,,8.0,2022-04-23T11:14Z,1,https://webtools.ccmc.gsfc.nasa.gov/DONKI/view/CMEAnalysis/19902/-1
2022-04-23T16:06Z,-7.0,-73.0,10.0,488.0,S,True,2022-04-23T10:24:00-CME-001,"Very narrow, possibly as narrow as 8 degrees half-width.",M2M_CATALOG,SH,0,SWPC_CAT,running difference,,,13.6,2022-04-23T13:48Z,1,https://webtools.ccmc.gsfc.nasa.gov/DONKI/view/CMEAnalysis/19905/-1
2022-04-24T15:21Z,-17.0,-110.0,43.0,665.0,C,True,2022-04-24T09:23:00-CME-001,Remeasured with C3/COR2A following SOHO data backfill.,M2M_CATALOG,LE,0,SWPC_CAT,running difference,,,16.1,2022-04-24T15:09Z,1,https://webtools.ccmc.gsfc.nasa.gov/DONKI/view/CMEAnalysis/19914/-1
2022-04-24T18:34Z,-38.0,56.0,24.0,473.0,S,True,2022-04-24T11:23:00-CME-001,Remeasured following SOHO data backfill.,M2M_CATALOG,LE,0,SWPC_CAT,running difference,,,10.0,2022-04-24T15:11Z,1,https://webtools.ccmc.gsfc.nasa.gov/DONKI/view/CMEAnalysis/19915/-1
2022-04-24T22:35Z,34.0,1.0,20.0,612.0,C,True,2022-04-24T16:48:00-CME-001,It gets pretty faint by the time it exits either coronagraph FOV.,M2M_CATALOG,LE,0,SWPC_CAT,running difference,,,9.0,2022-04-25T12:25Z,1,https://webtools.ccmc.gsfc.nasa.gov/DONKI/view/CMEAnalysis/19921/-1
2022-04-25T20:25Z,-20.0,-92.0,18.0,407.0,S,True,2022-04-25T11:00:00-CME-001,,M2M_CATALOG,LE,0,SWPC_CAT,running difference,,,11.2,2022-04-25T16:40Z,1,https://webtools.ccmc.gsfc.nasa.gov/DONKI/view/CMEAnalysis/19925/-1
2022-04-26T02:58Z,-21.0,-92.0,34.0,407.0,S,True,2022-04-25T18:23:00-CME-001,Measurement using backfilled SOHO imagery; the CME was not visible well in frames of SOHO/C3.,M2M_CATALOG,LE,0,SWPC_CAT,running difference,,,5.0,2022-04-26T12:37Z,1,https://webtools.ccmc.gsfc.nasa.gov/DONKI/view/CMEAnalysis/19930/-1
2022-04-26T03:21Z,-21.0,-95.0,44.0,530.0,C,True,2022-04-25T20:24:00-CME-001,These parameters are based off of the best fit between SOHO LASCO C3 and STEREO A COR2. The latitude may be adjusted by +5 degrees to account for more northern features in the difference imagery. This fit includes a more southern feature in the fit.,M2M_CATALOG,LE,0,SWPC_CAT,running difference,,,,2022-04-26T13:49Z,1,https://webtools.ccmc.gsfc.nasa.gov/DONKI/view/CMEAnalysis/19935/-1
