time21_5,latitude,longitude,halfAngle,speed,type,isMostAccurate,associatedCMEID,note,catalog,featureCode,dataLevel,measurementTechnique,imageType,tilt,minorHalfWidth,speedMeasuredAtHeight,submissionTime,versionId,link
2023-05-20T05:06Z,-53.0,-70.0,45.0,383.0,S,True,2023-05-19T19:36:00-CME-001,This analysis is very uncertain since the source for this CME has not been found and it is very faint especially in STEREO A COR2.,M2M_CATALOG,LE,0,SWPC_CAT,running difference,,,,2023-05-20T19:45Z,1,https://webtools.ccmc.gsfc.nasa.gov/DONKI/view/CMEAnalysis/25268/-1
2023-05-21T00:35Z,-22.0,110.0,10.0,474.0,S,True,2023-05-20T17:36:00-CME-001,Two spacecraft leading edge measurement of the jet using triangulation to determine an approximate source.,M2M_CATALOG,LE,0,SWPC_CAT,running difference,,,11.3,2023-05-21T13:05Z,1,https://webtools.ccmc.gsfc.nasa.gov/DONKI/view/CMEAnalysis/25276/-1
2023-05-21T05:54Z,-28.0,-161.0,21.0,329.0,S,True,2023-05-20T20:12:00-CME-001,"Leading edge measurement--the CME becomes diffuse such that its original width appears to be reduced to that of a more narrow, jet-like CME, though this measurement incorporates a larger half-width reminiscent of the original width that is first observed.",M2M_CATALOG,LE,0,SWPC_CAT,running difference,,,9.1,2023-05-21T14:37Z,1,https://webtools.ccmc.gsfc.nasa.gov/DONKI/view/CMEAnalysis/25279/-1
2023-05-21T13:48Z,-33.0,-159.0,29.0,307.0,S,True,2023-05-21T02:36:00-CME-001,Leading edge measurement mostly relying on SOHO C2 imagery as the event becomes too diffuse to reliably see in STEREO A COR2 running difference imagery.,M2M_CATALOG,LE,0,SWPC_CAT,running difference,,,8.5,2023-05-21T14:41Z,1,https://webtools.ccmc.gsfc.nasa.gov/DONKI/view/CMEAnalysis/25281/-1
2023-05-21T20:59Z,-53.0,180.0,31.0,469.0,S,True,2023-05-21T13:36:00-CME-001,"Leading edge measurement of the CME using triangulation between SOHO and STEREO A to determine the source longitude. There is a bit of uncertainty given the proximity between SOHO and STEREO A to each other, but confidence is high that the eruption occurred on the far-side.",M2M_CATALOG,LE,0,SWPC_CAT,running difference,,,7.0,2023-05-21T15:57Z,1,https://webtools.ccmc.gsfc.nasa.gov/DONKI/view/CMEAnalysis/25286/-1
2023-05-22T02:11Z,5.0,-178.0,45.0,1452.0,O,True,2023-05-22T00:12:00-CME-001,Leading edge of the faint halo using two spacecraft to triangulate the longitude.,M2M_CATALOG,LE,0,SWPC_CAT,running difference,,,19.0,2023-05-22T12:38Z,1,https://webtools.ccmc.gsfc.nasa.gov/DONKI/view/CMEAnalysis/25295/-1
2023-05-22T12:58Z,11.0,102.0,37.0,345.0,S,True,2023-05-22T02:48:00-CME-001,Two spacecraft leading edge measurement.,M2M_CATALOG,LE,0,SWPC_CAT,running difference,,,8.3,2023-05-22T17:41Z,1,https://webtools.ccmc.gsfc.nasa.gov/DONKI/view/CMEAnalysis/25303/-1
2023-05-22T16:15Z,80.0,107.0,17.0,514.0,C,True,2023-05-22T08:24:00-CME-001,Updated leading measurement.,M2M_CATALOG,LE,0,SWPC_CAT,running difference,,,12.0,2023-05-22T16:10Z,1,https://webtools.ccmc.gsfc.nasa.gov/DONKI/view/CMEAnalysis/25301/-1
2023-05-23T01:52Z,-41.0,-20.0,31.0,298.0,S,True,2023-05-22T14:09:00-CME-001,Two spacecraft leading edge measurement which matched the source latitude/longitude quite well. The CME became too diffuse to reliably measure before leaving the C2 field of view.,M2M_CATALOG,LE,0,SWPC_CAT,running difference,,,7.5,2023-05-22T18:38Z,1,https://webtools.ccmc.gsfc.nasa.gov/DONKI/view/CMEAnalysis/25306/-1
2023-05-23T00:05Z,5.0,-129.0,21.0,380.0,S,True,2023-05-22T15:12:00-CME-001,Leading edge measurement using SOHO C2 and STEREO A COR2 to triangulate the possible longitude; there are uncertainties as much as 15 degrees with the longitude due to the lack of a visible source.,M2M_CATALOG,LE,0,SWPC_CAT,running difference,,,6.6,2023-05-22T19:22Z,1,https://webtools.ccmc.gsfc.nasa.gov/DONKI/view/CMEAnalysis/25309/-1
2023-05-23T10:08Z,44.0,114.0,18.0,432.0,S,True,2023-05-23T01:25:00-CME-001,Analysis based on fit in swpc_cat and the assumption that the CME is behind the NW limb in coronagraphs.,M2M_CATALOG,LE,0,SWPC_CAT,running difference,,,,2023-05-23T14:36Z,1,https://webtools.ccmc.gsfc.nasa.gov/DONKI/view/CMEAnalysis/25315/-1
2023-05-23T14:41Z,19.0,65.0,24.0,529.0,C,True,2023-05-23T08:12:00-CME-001,Analysis based on a good fit in swpc_cat and on the possible source the large filament eruption.,M2M_CATALOG,LE,0,SWPC_CAT,running difference,,,,2023-05-23T15:22Z,1,https://webtools.ccmc.gsfc.nasa.gov/DONKI/view/CMEAnalysis/25317/-1
2023-05-23T14:52Z,-8.0,-159.0,45.0,869.0,C,True,2023-05-23T11:09:00-CME-001,Updated bulk parameters based on additional SOHO imagery.,M2M_CATALOG,LE,0,SWPC_CAT,running difference,,,14.1,2023-05-23T17:02Z,1,https://webtools.ccmc.gsfc.nasa.gov/DONKI/view/CMEAnalysis/25320/-1
2023-05-24T04:08Z,-19.0,-90.0,10.0,907.0,C,True,2023-05-24T00:24:00-CME-001,Longitude obtained by the best fit in swpc_cat in two coronagraphs (since source is on/behind the limb),M2M_CATALOG,LE,0,SWPC_CAT,running difference,,,,2023-05-24T12:22Z,1,https://webtools.ccmc.gsfc.nasa.gov/DONKI/view/CMEAnalysis/25334/-1
2023-05-24T07:45Z,27.0,41.0,13.0,589.0,C,True,2023-05-24T02:00:00-CME-001,"Analysis based on the best fit in swpc_cat with 2 coronagraphs, confirmed by the possible source (dimming seen in AIA 193).",M2M_CATALOG,LE,0,SWPC_CAT,running difference,,,,2023-05-24T13:20Z,1,https://webtools.ccmc.gsfc.nasa.gov/DONKI/view/CMEAnalysis/25338/-1
2023-05-24T12:43Z,42.0,-105.0,13.0,664.0,C,True,2023-05-24T07:36:00-CME-001,"Analysis based on the best fit in swpc_cat since the source is behind the limb, hence parameters are uncertain.",M2M_CATALOG,LE,0,SWPC_CAT,running difference,,,,2023-05-24T17:29Z,2,https://webtools.ccmc.gsfc.nasa.gov/DONKI/view/CMEAnalysis/25336/-1
2023-05-24T16:49Z,-3.0,-145.0,32.0,617.0,C,True,2023-05-24T10:36:00-CME-001,Analysis of a narrower and brighter feature which is likely the bulk of the CME.,M2M_CATALOG,LE,0,SWPC_CAT,running difference,,,,2023-05-24T17:33Z,1,https://webtools.ccmc.gsfc.nasa.gov/DONKI/view/CMEAnalysis/25344/-1
2023-05-25T15:15Z,-31.0,125.0,33.0,548.0,C,True,2023-05-25T08:24:00-CME-001,Measurement made using knowledge that source location is beyond the SW limb and best fit between C2/C3 and COR2A imagery.,M2M_CATALOG,LE,0,SWPC_CAT,running difference,,,13.5,2023-05-25T16:09Z,1,https://webtools.ccmc.gsfc.nasa.gov/DONKI/view/CMEAnalysis/25352/-1
2023-05-26T01:03Z,-31.0,32.0,34.0,344.0,S,True,2023-05-25T15:36:00-CME-001,One spacecraft STEREOCat method of the leading edge of the CME.,M2M_CATALOG,LE,0,StereoCAT,running difference,,,,2023-05-25T19:51Z,1,https://webtools.ccmc.gsfc.nasa.gov/DONKI/view/CMEAnalysis/25357/-1
2023-05-26T00:51Z,1.0,-124.0,32.0,1314.0,O,True,2023-05-25T21:53:00-CME-001,These parameters are based on the best fit of the brightest portion seen in white-light and difference imagery. StereoCAT measurements agree with similar parameters. Longitude may vary by +/-5 degrees.,M2M_CATALOG,LE,0,SWPC_CAT,running difference,,,15.0,2023-05-26T15:13Z,1,https://webtools.ccmc.gsfc.nasa.gov/DONKI/view/CMEAnalysis/25363/-1
2023-05-26T00:33Z,8.0,-170.0,45.0,1349.0,O,True,2023-05-25T22:12:00-CME-001,Preliminary analysis - updated measurements likely.,M2M_CATALOG,LE,0,SWPC_CAT,running difference,,,,2023-05-26T19:42Z,1,https://webtools.ccmc.gsfc.nasa.gov/DONKI/view/CMEAnalysis/25372/-1
2023-05-26T05:17Z,-10.0,85.0,29.0,1655.0,O,True,2023-05-26T03:12:00-CME-001,Analysis based on assumption that this CME is the more central narrower part of the complex picture in coronagraphs that can be best separated from 2023-05-26T03:24Z CME as the narrower westward protruding feature justaxposed with a fainter later but wider 2023-05-26T03:24Z CME in the  SOHO LASCO C2 timestamp 2023-05-26T03:24Z.,M2M_CATALOG,SH,0,SWPC_CAT,running difference,,,,2023-05-26T17:12Z,3,https://webtools.ccmc.gsfc.nasa.gov/DONKI/view/CMEAnalysis/25367/-1
2023-05-26T05:57Z,-9.0,85.0,33.0,1249.0,O,True,2023-05-26T03:12:00-CME-001,"Measurement of what looks like the bulk of this CME, excluding its faster, protruding nose (which we interpret as the shock).",M2M_CATALOG,LE,0,SWPC_CAT,running difference,,,,2023-05-26T17:12Z,1,https://webtools.ccmc.gsfc.nasa.gov/DONKI/view/CMEAnalysis/25368/-1
2023-05-26T05:56Z,-6.0,124.0,48.0,1277.0,O,True,2023-05-26T03:24:00-CME-001,"Preliminary imperfect analysis based on the best fit in swpc_cat with two coronagraphs, taking into account the likely behind the limb source indicated by moving field lines in the west.",M2M_CATALOG,LE,0,SWPC_CAT,running difference,,,,2023-05-26T16:13Z,2,https://webtools.ccmc.gsfc.nasa.gov/DONKI/view/CMEAnalysis/25365/-1
2023-05-26T15:35Z,3.0,-105.0,14.0,448.0,S,True,2023-05-26T08:00:00-CME-001,Parameters are approximate as the CME front is very diffuse and the CME is faint and seen in few timestamps in SOHO LASCO C2 and STEREO A COR2 coronagraphs.,M2M_CATALOG,LE,0,SWPC_CAT,running difference,,,,2023-05-28T13:26Z,1,https://webtools.ccmc.gsfc.nasa.gov/DONKI/view/CMEAnalysis/25393/-1
2023-05-26T23:02Z,-8.0,-105.0,21.0,431.0,S,True,2023-05-26T15:12:00-CME-001,,M2M_CATALOG,LE,0,SWPC_CAT,running difference,,,,2023-05-28T13:42Z,1,https://webtools.ccmc.gsfc.nasa.gov/DONKI/view/CMEAnalysis/25395/-1
2023-05-27T04:53Z,-33.0,-9.0,27.0,316.0,S,True,2023-05-26T18:24:00-CME-001,"Very approximate analysis assuming the front-sided source and based on the best fit in swpc_cat with both coronagraphs. Fits the position of dimming south of AR 3315 as the source, but latitudes can vary from -25 to -45 or so.",M2M_CATALOG,LE,0,SWPC_CAT,running difference,,,,2023-05-28T14:14Z,2,https://webtools.ccmc.gsfc.nasa.gov/DONKI/view/CMEAnalysis/25385/-1
2023-05-27T18:17Z,-67.0,31.0,28.0,350.0,S,True,2023-05-27T08:48:00-CME-001,"B/c the source has not been found, this is a very uncertain analysis based on an unfounded assumption that this CME is front sided. Parameters are arrived at through the best fit in swpc_cat with two coronagraphs.",M2M_CATALOG,LE,0,SWPC_CAT,running difference,,,,2023-05-28T11:45Z,1,https://webtools.ccmc.gsfc.nasa.gov/DONKI/view/CMEAnalysis/25389/-1
2023-05-27T17:37Z,-14.0,-110.0,31.0,655.0,C,True,2023-05-27T12:24:00-CME-001,"Analysis based on the source seen behind the East limb in STEREO and SDO and on the best fit in swpc_cat with two coronagraph. Early timestamps, so needs to be remeasured.",M2M_CATALOG,LE,0,SWPC_CAT,running difference,,,,2023-05-27T14:29Z,1,https://webtools.ccmc.gsfc.nasa.gov/DONKI/view/CMEAnalysis/25378/-1
2023-05-28T05:58Z,-52.0,30.0,34.0,348.0,S,True,2023-05-27T20:00:00-CME-001,"Measurement using best fit between coronagraphs. There is heavy southern deflection, which was anticipated given the signatures in UV imagery. This CME is very faint in difference imagery and was too faint to distinguish in C3 difference imagery.",M2M_CATALOG,LE,0,StereoCAT,running difference,,,7.2,2023-05-28T17:32Z,1,https://webtools.ccmc.gsfc.nasa.gov/DONKI/view/CMEAnalysis/25401/-1
2023-05-28T19:11Z,22.0,-19.0,16.0,479.0,S,True,2023-05-28T13:25:00-CME-001,"Measurement made using one coronagraph and knowledge of the source location. The leading edge was indistinguishable in difference imagery, and COR2A was in a large data gap.",M2M_CATALOG,LE,0,SWPC_CAT,running difference,,,13.3,2023-05-29T19:24Z,1,https://webtools.ccmc.gsfc.nasa.gov/DONKI/view/CMEAnalysis/25407/-1
2023-05-29T06:31Z,26.0,26.0,23.0,778.0,C,True,2023-05-29T02:12:00-CME-001,"Measurement taken using knowledge of source location (N25W20), then best fit between C2 and COR2A. The leading edge of this CME is extremely diffuse; made similar features can be seen moving at similar rates.",M2M_CATALOG,LE,0,SWPC_CAT,running difference,,,16.8,2023-05-29T15:57Z,1,https://webtools.ccmc.gsfc.nasa.gov/DONKI/view/CMEAnalysis/25405/-1
2023-05-31T04:38Z,7.0,26.0,30.0,311.0,S,True,2023-05-30T17:12:00-CME-001,"Speculative measurement using SOHO and STEREO A to triangulate the source; there is medium confidence in the speed and longitude parameters, though the source was undetermined/unclear. The CME is difficult if not impossible to associate with/match with far-side activity using triangulation.",M2M_CATALOG,LE,0,SWPC_CAT,running difference,,,13.4,2023-05-31T13:28Z,1,https://webtools.ccmc.gsfc.nasa.gov/DONKI/view/CMEAnalysis/25420/-1
2023-05-31T12:35Z,-13.0,37.0,15.0,300.0,S,True,2023-05-31T01:25:00-CME-001,Leading measurement using only SOHO C2 and STEREO A COR2. Upper bound velocity measurement.,M2M_CATALOG,LE,0,SWPC_CAT,running difference,,,12.5,2023-05-31T16:34Z,1,https://webtools.ccmc.gsfc.nasa.gov/DONKI/view/CMEAnalysis/25424/-1
2023-06-01T02:44Z,54.0,80.0,38.0,1662.0,O,True,2023-06-01T00:36:00-CME-001,"Measurement based on the best fit between SOHO LASCO C2/C3 and STEREO A COR2, as well as the source location. The measurement has a higher latitude than the source likely due to deflection and that a higher latitude was necessary to include the entire width of the event.",M2M_CATALOG,LE,0,SWPC_CAT,running difference,,,17.5,2023-06-01T12:41Z,1,https://webtools.ccmc.gsfc.nasa.gov/DONKI/view/CMEAnalysis/25434/-1
2023-06-02T01:39Z,-41.0,115.0,28.0,345.0,S,True,2023-06-01T15:24:00-CME-001,Measurement based on the best fit between SOHO LASCO C2 and STEREO A COR2 imagery. The longitude may therefore vary by +/-10 degrees.,M2M_CATALOG,LE,0,SWPC_CAT,running difference,,,5.3,2023-06-01T18:16Z,1,https://webtools.ccmc.gsfc.nasa.gov/DONKI/view/CMEAnalysis/25439/-1
2023-06-02T12:08Z,-11.0,-170.0,21.0,262.0,S,True,2023-06-02T01:36:00-CME-001,"StereoCat measurement of the leading edge (or more specifically, its estimated location) since the leading edge is too diffuse to see in SWPC_Cat. Upper bound of velocity measurement.",M2M_CATALOG,LE,0,StereoCAT,running difference,,,,2023-06-02T16:56Z,1,https://webtools.ccmc.gsfc.nasa.gov/DONKI/view/CMEAnalysis/25442/-1
2023-06-02T22:39Z,20.0,127.0,10.0,1240.0,O,True,2023-06-02T20:00:00-CME-001,Approximate parameters as source has not been found and the CME front is very faint in most timestamps.,M2M_CATALOG,LE,0,SWPC_CAT,running difference,,,,2023-06-03T13:30Z,1,https://webtools.ccmc.gsfc.nasa.gov/DONKI/view/CMEAnalysis/25444/-1
2023-06-03T13:03Z,25.0,130.0,10.0,612.0,C,True,2023-06-03T07:48:00-CME-001,Approximate parameters obtained by a fit in swpc_cat with assumption that the CME is backsided.,M2M_CATALOG,LE,0,SWPC_CAT,running difference,,,,2023-06-03T13:48Z,1,https://webtools.ccmc.gsfc.nasa.gov/DONKI/view/CMEAnalysis/25446/-1
2023-06-04T15:44Z,-12.0,30.0,33.0,692.0,C,True,2023-06-04T10:24:00-CME-001,Measurement using later frames after downlink.,M2M_CATALOG,LE,0,SWPC_CAT,running difference,,,18.0,2023-06-04T16:57Z,1,https://webtools.ccmc.gsfc.nasa.gov/DONKI/view/CMEAnalysis/25455/-1
2023-06-05T02:41Z,0.0,90.0,13.0,522.0,C,True,2023-06-04T19:48:00-CME-001,Measured using best fit between C2 and COR2A coronagraphs. Leading edge becomes too diffuse to measure in C3 frames.,M2M_CATALOG,LE,0,SWPC_CAT,running difference,,,7.7,2023-06-05T17:05Z,1,https://webtools.ccmc.gsfc.nasa.gov/DONKI/view/CMEAnalysis/25462/-1
2023-06-05T20:52Z,-5.0,100.0,17.0,250.0,S,True,2023-06-05T06:24:00-CME-001,Leading edge becomes too diffuse to measure in later frames of SOHO LASCO C2 difference imagery and STEREO A COR2 difference imagery.,M2M_CATALOG,LE,0,SWPC_CAT,running difference,,,4.7,2023-06-05T20:07Z,1,https://webtools.ccmc.gsfc.nasa.gov/DONKI/view/CMEAnalysis/25469/-1
2023-06-06T06:59Z,3.0,90.0,13.0,232.0,S,True,2023-06-05T15:12:00-CME-001,Leading edge is diffuse in later frames of C2 and COR2A.,M2M_CATALOG,LE,0,SWPC_CAT,running difference,,,6.0,2023-06-05T20:44Z,1,https://webtools.ccmc.gsfc.nasa.gov/DONKI/view/CMEAnalysis/25471/-1
2023-06-06T04:50Z,-1.0,117.0,19.0,343.0,S,True,2023-06-05T18:48:00-CME-001,Measurement based on the best fit between SOHO LASCO C2 and STEREO A COR2. The longitude may vary by +/-10 degrees since there is no visible source location to confirm the measurement parameters.,M2M_CATALOG,LE,0,SWPC_CAT,running difference,,,5.6,2023-06-06T12:49Z,1,https://webtools.ccmc.gsfc.nasa.gov/DONKI/view/CMEAnalysis/25475/-1
2023-06-06T10:34Z,10.0,-63.0,44.0,617.0,C,True,2023-06-06T03:48:00-CME-001,"Measurement based on the source location, which was very close to the parameters that created the best fit between SOHO LASCO C2 and STEREO A COR2 imagery.",M2M_CATALOG,LE,0,SWPC_CAT,running difference,,,17.8,2023-06-06T12:28Z,1,https://webtools.ccmc.gsfc.nasa.gov/DONKI/view/CMEAnalysis/25473/-1
2023-06-07T12:59Z,43.0,-151.0,10.0,410.0,S,True,2023-06-07T04:36:00-CME-001,"Leading edge measurement with upper bound for half-width. Appeared to fit a front-sided and far-sided pair of longitudes, but confidence is higher about the far-sided source based on EUV coronal imagery.",M2M_CATALOG,LE,0,SWPC_CAT,running difference,,,14.0,2023-06-07T12:35Z,1,https://webtools.ccmc.gsfc.nasa.gov/DONKI/view/CMEAnalysis/25483/-1
2023-06-07T13:06Z,-15.0,-42.0,20.0,576.0,C,True,2023-06-07T07:00:00-CME-001,Updated measurement in an attempt to produce a better CME leading edge versus time fit.,M2M_CATALOG,LE,0,SWPC_CAT,running difference,,,14.0,2023-06-07T12:50Z,1,https://webtools.ccmc.gsfc.nasa.gov/DONKI/view/CMEAnalysis/25486/-1
2023-06-08T00:38Z,-14.0,-34.0,18.0,276.0,S,True,2023-06-07T12:48:00-CME-001,Leading edge measurement with two spacecraft (SOHO/STEREO A); the front becomes diffuse and disappears before leaving the field of view of both imagers.,M2M_CATALOG,LE,0,SWPC_CAT,running difference,,,7.8,2023-06-07T18:15Z,1,https://webtools.ccmc.gsfc.nasa.gov/DONKI/view/CMEAnalysis/25494/-1
2023-06-08T11:11Z,9.0,115.0,21.0,359.0,S,True,2023-06-08T00:48:00-CME-001,This measurement is uncertain; only a few frames were used for this measurement. Leading edge is very faint in STEREO A COR2 and becomes very diffuse halfway through SOHO LASCO C2 field of view.,M2M_CATALOG,LE,0,SWPC_CAT,running difference,,,5.0,2023-06-08T15:48Z,1,https://webtools.ccmc.gsfc.nasa.gov/DONKI/view/CMEAnalysis/25500/-1
2023-06-09T09:43Z,8.0,85.0,27.0,280.0,S,True,2023-06-08T21:12:00-CME-001,"Very uncertain analysis based on fit in swpc_cat, because the source is so minor and the CME front so faint.",M2M_CATALOG,LE,0,SWPC_CAT,running difference,,,,2023-06-10T00:58Z,1,https://webtools.ccmc.gsfc.nasa.gov/DONKI/view/CMEAnalysis/25520/-1
2023-06-09T03:01Z,-10.0,28.0,21.0,581.0,C,True,2023-06-08T21:24:00-CME-001,"A much more narrow interpretation of this CME, taking into account only its brighter more southern part and excluding the fainter more northern feature that is now considered a separate CME",M2M_CATALOG,LE,0,SWPC_CAT,running difference,,,,2023-06-09T16:24Z,1,https://webtools.ccmc.gsfc.nasa.gov/DONKI/view/CMEAnalysis/25510/-1
2023-06-09T11:48Z,32.0,-122.0,13.0,275.0,S,True,2023-06-08T22:00:00-CME-001,Measurement based on best fit between SOHO LASCO C2 and STEREO A COR2 imagery. The longitude may vary by +/-10 degrees since there is no source location to confirm the measured parameters.,M2M_CATALOG,LE,0,SWPC_CAT,running difference,,,8.7,2023-06-09T12:35Z,1,https://webtools.ccmc.gsfc.nasa.gov/DONKI/view/CMEAnalysis/25506/-1
2023-06-09T22:54Z,-23.0,-50.0,31.0,649.0,C,True,2023-06-09T17:36:00-CME-001,Preliminary measurement based on the source (flare) location and best fit between SOHO LASCO C2 and STEREO A COR2. The leading edge of the CMEis asymmetric and difficult to measure in early imagery.,M2M_CATALOG,LE,0,SWPC_CAT,running difference,,,7.1,2023-06-09T19:43Z,2,https://webtools.ccmc.gsfc.nasa.gov/DONKI/view/CMEAnalysis/25517/-1
2023-06-11T03:03Z,-48.0,-177.0,10.0,403.0,S,True,2023-06-10T19:00:00-CME-001,,M2M_CATALOG,LE,0,SWPC_CAT,running difference,,,,2023-06-11T16:08Z,1,https://webtools.ccmc.gsfc.nasa.gov/DONKI/view/CMEAnalysis/25528/-1
2023-06-11T03:41Z,-47.0,-100.0,31.0,425.0,S,True,2023-06-10T19:12:00-CME-001,"Since the source is backsided, the analysis is based on the fit in swpc_cat with 2 coronagraphs.",M2M_CATALOG,LE,0,SWPC_CAT,running difference,,,,2023-06-11T14:27Z,1,https://webtools.ccmc.gsfc.nasa.gov/DONKI/view/CMEAnalysis/25526/-1
2023-06-11T03:29Z,-48.0,-177.0,10.0,436.0,S,True,2023-06-10T19:48:00-CME-001,"Source not found, so analysis is based on the best fit in two coronagraphs in swpc_cat.",M2M_CATALOG,LE,0,SWPC_CAT,running difference,,,,2023-06-11T16:18Z,1,https://webtools.ccmc.gsfc.nasa.gov/DONKI/view/CMEAnalysis/25530/-1
2023-06-12T09:10Z,65.0,-1.0,37.0,647.0,C,True,2023-06-12T03:24:00-CME-001,"Analysis of a wider CME structure appearing later in coronagraphs based on a fit in swpc_cat. Does not well correspond to the approximate center of the erupting filament as seen in AIA 304, however there seems to be a more eastern part of the erupting filament which seems to appear in coronagraphs later than the more western part that was measured in the previous analysis. This analysis encompasses both parts.",M2M_CATALOG,LE,0,SWPC_CAT,running difference,,,,2023-06-12T17:09Z,1,https://webtools.ccmc.gsfc.nasa.gov/DONKI/view/CMEAnalysis/25536/-1
2023-06-13T02:15Z,-3.0,90.0,22.0,329.0,S,True,2023-06-12T15:12:00-CME-001,,M2M_CATALOG,LE,1,SWPC_CAT,direct,,,,2023-06-13T01:01Z,2,https://webtools.ccmc.gsfc.nasa.gov/DONKI/view/CMEAnalysis/25540/-1
2023-06-13T07:54Z,77.0,40.0,37.0,753.0,C,True,2023-06-13T02:12:00-CME-001,"Initial measurement, but high confidence in fit between coronagraphs and corroborates with center of filament eruption location and high northern latitude deflection.",M2M_CATALOG,LE,0,SWPC_CAT,running difference,,,18.0,2023-06-13T13:49Z,1,https://webtools.ccmc.gsfc.nasa.gov/DONKI/view/CMEAnalysis/25542/-1
2023-06-13T20:31Z,-5.0,90.0,16.0,448.0,S,True,2023-06-13T12:00:00-CME-001,This CME was tricky to measure as the leading edge is faint and becomes too diffuse to measure at about halfway through STEREO A COR2 field of view (in difference imagery). The CME was too faint to confidently measure in C3.,M2M_CATALOG,LE,0,SWPC_CAT,running difference,,,7.3,2023-06-13T19:44Z,1,https://webtools.ccmc.gsfc.nasa.gov/DONKI/view/CMEAnalysis/25546/-1
2023-06-14T01:26Z,14.0,119.0,18.0,551.0,C,True,2023-06-13T19:24:00-CME-001,"This event has a diffuse front and is difficult to track after a few frames. Measured parameters are based on the best fit between SOHO LASCO C2/C3 and STEREO A COR2 imagery, so the longitude may vary +/-10 degrees.",M2M_CATALOG,LE,0,SWPC_CAT,running difference,,,7.5,2023-06-14T15:25Z,1,https://webtools.ccmc.gsfc.nasa.gov/DONKI/view/CMEAnalysis/25552/-1
2023-06-14T05:03Z,-7.0,-88.0,10.0,641.0,C,True,2023-06-13T23:36:00-CME-001,Measurement based on the approximate source location. The leading edge of this event becomes diffuse quickly so only a few frames were usable.,M2M_CATALOG,LE,0,SWPC_CAT,running difference,,,6.1,2023-06-14T15:31Z,1,https://webtools.ccmc.gsfc.nasa.gov/DONKI/view/CMEAnalysis/25554/-1
2023-06-14T07:40Z,23.0,-122.0,12.0,553.0,C,True,2023-06-14T01:36:00-CME-001,Measurement based on the best fit between SOHO LASCO C2 and STEREO A COR2 imagery as there is no source location. The longitude may vary +/-10 degrees as a result.,M2M_CATALOG,LE,0,SWPC_CAT,running difference,,,6.0,2023-06-14T15:41Z,1,https://webtools.ccmc.gsfc.nasa.gov/DONKI/view/CMEAnalysis/25556/-1
2023-06-14T20:53Z,29.0,-91.0,11.0,261.0,S,True,2023-06-14T07:12:00-CME-001,Measurement based on the best fit between SOHO LASCO C2 and STEREO A COR2 imagery. The longitude may vary +/-10 degrees as there is no source location to confirm the measured parameters.,M2M_CATALOG,LE,0,SWPC_CAT,running difference,,,6.8,2023-06-14T15:46Z,1,https://webtools.ccmc.gsfc.nasa.gov/DONKI/view/CMEAnalysis/25558/-1
2023-06-14T15:49Z,-9.0,-75.0,10.0,576.0,C,True,2023-06-14T09:48:00-CME-001,This event is very narrow and likely has a half-width <10 degrees. The measured parameters are based on source location.,M2M_CATALOG,LE,0,SWPC_CAT,running difference,,,6.0,2023-06-14T15:52Z,1,https://webtools.ccmc.gsfc.nasa.gov/DONKI/view/CMEAnalysis/25560/-1
2023-06-14T18:17Z,29.0,-116.0,19.0,515.0,C,True,2023-06-14T11:24:00-CME-001,Since there is no source location the measured parameters are based on the best fit between SOHO LASCO C2 and STEREO A COR2 imagery. The longitude may therefore vary by +/-10 degrees.,M2M_CATALOG,LE,0,SWPC_CAT,running difference,,,7.1,2023-06-14T15:56Z,1,https://webtools.ccmc.gsfc.nasa.gov/DONKI/view/CMEAnalysis/25562/-1
2023-06-15T07:20Z,0.0,110.0,24.0,339.0,S,True,2023-06-14T20:12:00-CME-001,More careful measurement taken using more frames of coronagraph imagery than previous measurement. Leading edge becomes too diffuse to measure about halfway through COR2A field of view.,M2M_CATALOG,LE,0,SWPC_CAT,running difference,,,8.4,2023-06-16T13:26Z,1,https://webtools.ccmc.gsfc.nasa.gov/DONKI/view/CMEAnalysis/25582/-1
2023-06-16T12:23Z,39.0,-70.0,32.0,482.0,S,True,2023-06-16T05:48:00-CME-001,Two spacecraft leading edge measurement of the CME measuring the far eastern portion of the leading edge which moves the fastest.,M2M_CATALOG,LE,0,SWPC_CAT,running difference,,,14.0,2023-06-16T15:27Z,1,https://webtools.ccmc.gsfc.nasa.gov/DONKI/view/CMEAnalysis/25587/-1
2023-06-16T16:33Z,-11.0,134.0,35.0,332.0,S,True,2023-06-16T06:12:00-CME-001,Bulk measurement not incorporating the very leading edge in the center.,M2M_CATALOG,LE,0,SWPC_CAT,running difference,,,10.0,2023-06-16T13:41Z,1,https://webtools.ccmc.gsfc.nasa.gov/DONKI/view/CMEAnalysis/25584/-1
2023-06-16T21:05Z,40.0,117.0,21.0,271.0,S,True,2023-06-16T07:36:00-CME-001,Leading edge measurement using only early frames of SOHO/STA as the CME becomes very diffuse in later imagery.,M2M_CATALOG,LE,0,SWPC_CAT,running difference,,,7.0,2023-06-16T16:26Z,1,https://webtools.ccmc.gsfc.nasa.gov/DONKI/view/CMEAnalysis/25594/-1
2023-06-16T14:34Z,-4.0,-65.0,30.0,977.0,C,True,2023-06-16T11:09:00-CME-001,Leading edge measurement using all coronagraph imagery. CME was observed to slow down in later frames.,M2M_CATALOG,LE,0,SWPC_CAT,running difference,,,18.2,2023-06-16T15:49Z,1,https://webtools.ccmc.gsfc.nasa.gov/DONKI/view/CMEAnalysis/25590/-1
